{
  "$schema": "https://json-schema.org/draft/2020-12/schema",
  "$id": "https://discoveryathome.org/schema/v0/frontier.schema.json",
  "title": "Frontier record: the single authoritative accepted result, or a table of them",
  "type": "object",
  "required": ["schema", "statement", "status", "evidence_level", "scope", "review", "updated_on"],
  "properties": {
    "schema": { "const": "discover-frontier/v0" },
    "statement": { "type": "string", "description": "What is claimed, precisely." },
    "status": { "type": "string", "description": "Free-text status line for humans." },
    "evidence_level": {
      "type": "array", "minItems": 1, "uniqueItems": true,
      "items": { "enum": ["author-checked", "independently-checked", "maintainer-reviewed", "formally-verified", "externally-accepted"] },
      "description": "Every level that applies; not a ladder."
    },
    "claim_kind": {
      "type": "array", "minItems": 1, "uniqueItems": true,
      "items": { "enum": ["exact", "formal", "certified", "argument", "model", "measured", "observational"] },
      "description": "What kind of claim the statement is, and so what a check of it can establish (spec §5). Every kind that applies."
    },
    "external": {
      "type": "array", "description": "Outside authorities that keep this field's records and accepted the result (evidence level `externally-accepted`).",
      "items": {
        "type": "object", "required": ["authority", "url"],
        "properties": {
          "authority": { "type": "string", "description": "Who keeps the record: a records table, archive or catalogue." },
          "url": { "type": "string", "description": "Where the authority shows the accepted result." },
          "ref": { "type": "string", "description": "The authority's identifier for it, if any." },
          "accepted_on": { "type": "string", "format": "date" }
        }
      }
    },
    "metric": {
      "type": "object", "required": ["name", "value"],
      "properties": {
        "name": { "type": "string" },
        "value": { "type": "string", "description": "Exact representation, e.g. a rational." },
        "decimal": { "type": "string" },
        "direction": { "enum": ["higher-is-better", "lower-is-better"] },
        "bound": { "type": "string", "description": "The best proven bound on the other side, exact representation: no value can beat it. When the value meets it, the question is settled." },
        "bound_source": { "type": "string", "description": "Where the bound is proved: a path, DOI or URL." },
        "unit": { "type": "string", "description": "Unit shown beside the value, if any." }
      }
    },
    "history": { "type": "string", "description": "Path of the frontier's history: JSON Lines (or a JSON array), one entry per change, {date, value, statement, bound, case, formulation, by, source, note} (spec §5). Without it the hub derives a history from the record's git history." },
    "table": {
      "type": "object", "required": ["path", "key", "value"],
      "description": "A frontier made of many independent cases, one row each (spec §5, record tables). `statement` describes the family.",
      "properties": {
        "path": { "type": "string", "description": "The table file, from the repo root." },
        "format": { "enum": ["json", "jsonl", "csv"], "description": "Default: from the extension. JSON is an array of objects, or an object with a `rows` array." },
        "key": { "type": "array", "items": { "type": "string" }, "minItems": 1, "description": "Columns that identify a case, e.g. [\"v\", \"k\", \"t\"]; unique per row." },
        "value": { "type": "string", "description": "Column holding the case's best value so far." },
        "direction": { "enum": ["higher-is-better", "lower-is-better"] },
        "bound": { "type": "string", "description": "Column holding the best proven bound on the other side, where known. A row is open while it has no bound or its value doesn't meet it." },
        "object": { "type": "string", "description": "Column holding the path of the case's witness, the object a check recomputes." },
        "check_row": { "type": "array", "items": { "type": "string" }, "minItems": 1, "description": "Argv that checks one row, run from the repo root; {column} is replaced by the row's value in that column." },
        "check_row_minutes": { "type": "integer", "minimum": 0, "description": "Expected runtime of check_row on a typical row." },
        "by": { "type": "string", "description": "Column crediting who found the case's current value." },
        "source": { "type": "string", "description": "Column with where it came from: a PR (#123), a commit, or a URL." },
        "updated": { "type": "string", "description": "Column with the date (YYYY-MM-DD) the case's value last changed." }
      }
    },
    "formulation": {
      "type": "object", "required": ["id"],
      "description": "The exact problem the record answers (spec §5, Formulations). A changed model, objective or constraint set is a new formulation: its results start a new series and aren't compared with the old one's.",
      "properties": {
        "id": { "type": "string", "description": "Short name, changed whenever the problem changes, e.g. \"truss-25-grouped-v1\"." },
        "doc": { "type": "string", "description": "Where the formulation is defined." },
        "since": { "type": "string", "format": "date" },
        "replaces": { "type": "string", "description": "The formulation this one changed, and so isn't comparable with." }
      }
    },
    "suite": {
      "type": "object", "required": ["path", "current", "direction", "baselines", "instances"],
      "description": "A frontier that is a method, scored on held-out instances against named baselines (spec §5, Evaluation suites). `statement` says what the method achieves and against what.",
      "properties": {
        "path": { "type": "string", "description": "Results file, one row per run: method, instance, value, and optionally seed, machine, draw, by, source." },
        "format": { "enum": ["json", "jsonl", "csv"] },
        "objective": { "type": "string", "description": "What `value` measures, e.g. \"makespan\"." },
        "direction": { "enum": ["higher-is-better", "lower-is-better"] },
        "current": { "type": "string", "description": "The accepted method: the one the statement is about." },
        "baselines": {
          "type": "array", "minItems": 1,
          "items": {
            "type": "object", "required": ["method", "strength"],
            "properties": {
              "method": { "type": "string", "description": "Its name in the results file." },
              "strength": { "enum": ["starter", "published", "mature"], "description": "starter: the project's own first implementation. published: a method from the literature, as implemented here. mature: an established solver the field relies on (a CP-SAT, a tuned tabu search, a commercial optimizer)." },
              "source": { "type": "string", "description": "Paper, package or URL." },
              "version": { "type": "string", "description": "Pinned version of a solver." }
            }
          }
        },
        "instances": {
          "type": "object", "required": ["draw"],
          "properties": {
            "draw": { "enum": ["fixed", "drawn", "sealed"], "description": "fixed: a public, frozen set (methods may have been tuned to it). drawn: generated from randomness fixed after the method was, e.g. a public beacon round later than the method's commit. sealed: held privately by the maintainers and run by them, published after each round." },
            "count": { "type": "integer", "minimum": 1, "description": "Instances per evaluation." },
            "generator": { "type": "array", "items": { "type": "string" }, "description": "Argv that generates instances; {seed} and {count} are replaced." },
            "beacon": { "type": "string", "description": "drawn: the public randomness source, e.g. \"drand-quicknet\"; results name the round in `draw`." },
            "dev": { "type": "string", "description": "A public development set to tune on, kept apart from the held-out instances." },
            "note": { "type": "string" }
          }
        },
        "budget": {
          "type": "object", "required": ["unit", "amount"],
          "description": "What each run may spend. Prefer a unit that doesn't depend on the machine (evaluations, feasibility checks, nodes); with a time unit, results carry `machine` and runs pair only within one.",
          "properties": { "unit": { "type": "string" }, "amount": { "type": "number", "minimum": 0 }, "note": { "type": "string" } }
        },
        "evaluate": { "type": "array", "items": { "type": "string" }, "minItems": 1, "description": "Argv that runs one method on a draw and prints result rows; {method} and {draw} are replaced." },
        "evaluate_minutes": { "type": "integer", "minimum": 0 }
      }
    },
    "scope": { "type": "string", "description": "Conditions under which the statement holds." },
    "assumptions": {
      "type": "array", "description": "Open obligations the statement depends on.",
      "items": {
        "type": "object", "required": ["id", "statement"],
        "properties": { "id": { "type": "string" }, "statement": { "type": "string" }, "status": { "enum": ["open", "partial", "closed"] }, "link": { "type": "string" } }
      }
    },
    "sources": { "type": "array", "items": { "type": "string" }, "description": "PR numbers, commits or URLs the result is assembled from." },
    "artifacts": {
      "type": "array",
      "items": { "type": "object", "required": ["path", "sha256"], "properties": { "path": { "type": "string" }, "sha256": { "type": "string", "pattern": "^[0-9a-f]{64}$" }, "role": { "type": "string" } } }
    },
    "reproduce": { "type": "string", "description": "Command that checks the result from a clean checkout; may be incremental on hash-identified, verified predecessors." },
    "reproduce_full": { "type": "string", "description": "Full replay from scratch, when it differs from `reproduce`." },
    "reproduce_minutes": { "type": "integer", "minimum": 0, "description": "Expected runtime of `reproduce` on an ordinary machine." },
    "prerequisites": { "type": "array", "items": { "type": "string" }, "description": "What a newcomer must install before `reproduce` runs." },
    "review": { "type": "string", "description": "Path or URL of the maintainer review." },
    "previous_record": { "type": "string" },
    "pinned_heads": { "type": "object", "additionalProperties": { "type": "string" } },
    "updated_on": { "type": "string", "format": "date" }
  }
}
